### ISSUE TITLE
ASSERT (3.2.1744 tcpdump) core/linux/loader.c:422 lib_base != NULL

### ISSUE THREAD

**Issue by derekbruening** [DynamoRIO/dynamorio#1001]
_From [byron.c....@gmail.com](https://code.google.com/u/101184679827294438523/) on December 03, 2012 18:54:42_
1. This is a custom build of DynamoRIO, checked out from " http://dynamorio.googlecode.com/svn/trunk/ " on 2012-11-30.
2. My machine is running Ubuntu 12.04 with packages updated within the last week.
3. The application is "tcpdump" version 4.2.1, with libpcap version 1.1.1.
4. Since libpcap is 64-bit, I would assume that tcpdump must also be.
5. The command line for launching with DR is:
   
     $DYNAMORIO_HOME/bin64/drrun -early -debug tcpdump -c 5 -n
6. The command line without DR is:
   
     tcpdump -c 5 -n
   
   and results in:
   
     tcpdump: verbose output suppressed, use -v or -vv for full protocol decode
     listening on eth1, link-type EN10MB (Ethernet), capture size 65535 bytes
     15:31:45.442209 IP 128.195.205.99.137 > 128.195.205.255.137: NBT UDP PACKET(137): QUERY; REQUEST; BROADCAST
     15:31:45.572267 ARP, Request who-has 128.195.205.118 tell 128.195.204.96, length 46
     15:31:45.598548 ARP, Request who-has 128.195.204.25 tell 128.195.204.102, length 46
     15:31:45.928603 IP 128.195.204.36.631 > 128.195.205.255.631: UDP, length 153
     15:31:46.073327 IP 128.195.204.22.137 > 128.195.205.255.137: NBT UDP PACKET(137): QUERY; REQUEST; BROADCAST
7. No client is being used in this scenario.
8. Using the -debug flag prints one curiosity and one assert before exiting. Here is the output:
   
     <CURIOSITY : !fail || result == -9 || result == -13 || result == -22 || result == -26 || result == -11 || result == -12 || result == -19 || result == -14 in file /home/bhawkins/lib/dynamorio_2012-11-30/core/linux/os.c line 2753
     version 3.2.1744, custom build
   
     0x00007fff5f9efd40 0x00000000712c17d4
     0x00007fff5f9efd80 0x00000000712c444d
     0x00007fff5f9efde0 0x00000000712ed9df
     0x00007fff5f9efee0 0x00000000712f00cf
     0x00007fff5f9f0230 0x0000000071291ca8>
     <Application /usr/sbin/tcpdump (3052).  Internal Error Internal DynamoRIO Error: /home/bhawkins/lib/dynamorio_2012-11-30/core/linux/loader.c:422 lib_base != NULL
     (Error occurred @-1 frags)
     version 3.2.1744, custom build
   
     0x00007fff5f9efc80 0x000000007111673b
     0x00007fff5f9efde0 0x00000000712eda13
     0x00007fff5f9efee0 0x00000000712f00cf
     0x00007fff5f9f0230 0x0000000071291ca8>
9. This DynamoRIO crash can be reproduced by following the steps I have mentioned above.

_Original issue: http://code.google.com/p/dynamorio/issues/detail?id=1001_
